{
  "$schema": "https://json-schema.org/draft/2020-12/schema",
  "$id": "https://raw.githubusercontent.com/salus-ryan/agi-format/main/schemas/module-v0.1.0.json",
  "title": ".agi module manifest v0.1.0",
  "type": "object",
  "required": ["name", "version", "components", "dependencies", "inputs", "outputs"],
  "additionalProperties": false,
  "properties": {
    "name": {"type": "string", "minLength": 1, "maxLength": 64, "pattern": "^[a-z][a-z0-9_-]*$"},
    "version": {"type": "string", "pattern": "^(0|[1-9][0-9]*)\\.(0|[1-9][0-9]*)\\.(0|[1-9][0-9]*)(?:[-+][0-9A-Za-z.-]+)?$"},
    "description": {"type": "string", "maxLength": 4096},
    "components": {
      "type": "array",
      "minItems": 1,
      "items": {
        "type": "object",
        "required": ["name", "path", "type", "interface"],
        "additionalProperties": false,
        "properties": {
          "name": {"type": "string", "minLength": 1, "maxLength": 128},
          "path": {"type": "string", "pattern": "^(?!/)(?!.*(?:^|/)\\.\\.(?:/|$))(?!.*\\\\).+\\.json$"},
          "type": {"enum": ["adapter", "engine", "store", "planner", "tool", "policy"]},
          "interface": {"type": "string", "minLength": 1, "maxLength": 256}
        }
      }
    },
    "dependencies": {"type": "array", "uniqueItems": true, "items": {"type": "string"}},
    "inputs": {"type": "array", "items": {"$ref": "#/$defs/port"}},
    "outputs": {"type": "array", "items": {"$ref": "#/$defs/port"}}
  },
  "$defs": {
    "port": {
      "type": "object",
      "required": ["name", "type"],
      "additionalProperties": false,
      "properties": {
        "name": {"type": "string", "minLength": 1},
        "type": {"type": "string", "minLength": 1},
        "from": {"type": "string", "minLength": 1},
        "to": {"type": "string", "minLength": 1}
      }
    }
  }
}
